北上市,-1,-1,-2078,名詞,固有名詞,地域,一般,*,*,北上市,キタカミシ,キタカミシ
北九州市八幡東区,-1,-1,-9050,名詞,固有名詞,地域,一般,*,*,北九州市八幡東区,キタキュウシュウシヤハタヒガシク,キタキュウシュウシヤハタヒガシク
北九州市八幡西区,-1,-1,-9050,名詞,固有名詞,地域,一般,*,*,北九州市八幡西区,キタキュウシュウシヤハタニシク,キタキュウシュウシヤハタニシク
北九州市小倉北区,-1,-1,-9050,名詞,固有名詞,地域,一般,*,*,北九州市小倉北区,キタキュウシュウシコクラキタク,キタキュウシュウシコクラキタク
北九州市小倉南区,-1,-1,-9050,名詞,固有名詞,地域,一般,*,*,北九州市小倉南区,キタキュウシュウシコクラミナミク,キタキュウシュウシコクラミナミク
北九州市戸畑区,-1,-1,-7408,名詞,固有名詞,地域,一般,*,*,北九州市戸畑区,キタキュウシュウシトバタク,キタキュウシュウシトバタク
北九州市若松区,-1,-1,-7408,名詞,固有名詞,地域,一般,*,*,北九州市若松区,キタキュウシュウシワカマツク,キタキュウシュウシワカマツク
北九州市門司区,-1,-1,-7408,名詞,固有名詞,地域,一般,*,*,北九州市門司区,キタキュウシュウシモジク,キタキュウシュウシモジク
北佐久郡御代田町,-1,-1,-9050,名詞,固有名詞,地域,一般,*,*,北佐久郡御代田町,キタサクグンミヨタマチ,キタサクグンミヨタマチ
北佐久郡立科町,-1,-1,-7408,名詞,固有名詞,地域,一般,*,*,北佐久郡立科町,キタサクグンタテシナマチ,キタサクグンタテシナマチ
北佐久郡軽井沢町,-1,-1,-9050,名詞,固有名詞,地域,一般,*,*,北佐久郡軽井沢町,キタサクグンカルイザワマチ,キタサクグンカルイザワマチ
北区,-1,-1,-1131,名詞,固有名詞,地域,一般,*,*,北区,キタク,キタク
北名古屋市,-1,-1,-4472,名詞,固有名詞,地域,一般,*,*,北名古屋市,キタナゴヤシ,キタナゴヤシ
北宇和郡松野町,-1,-1,-7408,名詞,固有名詞,地域,一般,*,*,北宇和郡松野町,キタウワグンマツノチョウ,キタウワグンマツノチョウ
北宇和郡鬼北町,-1,-1,-7408,名詞,固有名詞,地域,一般,*,*,北宇和郡鬼北町,キタウワグンキホクチョウ,キタウワグンキホクチョウ
北安曇郡小谷村,-1,-1,-7408,名詞,固有名詞,地域,一般,*,*,北安曇郡小谷村,キタアヅミグンオタリムラ,キタアヅミグンオタリムラ
北安曇郡松川村,-1,-1,-7408,名詞,固有名詞,地域,一般,*,*,北安曇郡松川村,キタアヅミグンマツカワムラ,キタアヅミグンマツカワムラ
北安曇郡池田町,-1,-1,-7408,名詞,固有名詞,地域,一般,*,*,北安曇郡池田町,キタアヅミグンイケダマチ,キタアヅミグンイケダマチ
北安曇郡白馬村,-1,-1,-7408,名詞,固有名詞,地域,一般,*,*,北安曇郡白馬村,キタアヅミグンハクバムラ,キタアヅミグンハクバムラ
北広島市,-1,-1,-3200,名詞,固有名詞,地域,一般,*,*,北広島市,キタヒロシマシ,キタヒロシマシ
北斗市,-1,-1,-2078,名詞,固有名詞,地域,一般,*,*,北斗市,ホクトシ,ホクトシ
北本市,-1,-1,-2078,名詞,固有名詞,地域,一般,*,*,北本市,キタモトシ,キタモトシ
北村山郡大石田町,-1,-1,-9050,名詞,固有名詞,地域,一般,*,*,北村山郡大石田町,キタムラヤマグンオオイシダマチ,キタムラヤマグンオオイシダマチ
北杜市,-1,-1,-2078,名詞,固有名詞,地域,一般,*,*,北杜市,ホクトシ,ホクトシ
北松浦郡佐々町,-1,-1,-7408,名詞,固有名詞,地域,一般,*,*,北松浦郡佐々町,キタマツウラグンサザチョウ,キタマツウラグンサザチョウ
北松浦郡小値賀町,-1,-1,-9050,名詞,固有名詞,地域,一般,*,*,北松浦郡小値賀町,キタマツウラグンオヂカチョウ,キタマツウラグンオヂカチョウ
北津軽郡中泊町,-1,-1,-7408,名詞,固有名詞,地域,一般,*,*,北津軽郡中泊町,キタツガルグンナカドマリマチ,キタツガルグンナカドマリマチ
北津軽郡板柳町,-1,-1,-7408,名詞,固有名詞,地域,一般,*,*,北津軽郡板柳町,キタツガルグンイタヤナギマチ,キタツガルグンイタヤナギマチ
北津軽郡鶴田町,-1,-1,-7408,名詞,固有名詞,地域,一般,*,*,北津軽郡鶴田町,キタツガルグンツルタマチ,キタツガルグンツルタマチ
北海道,-1,-1,-2078,名詞,固有名詞,地域,一般,*,*,北海道,ホッカイドウ,ホッカイドウ
北牟婁郡紀北町,-1,-1,-7408,名詞,固有名詞,地域,一般,*,*,北牟婁郡紀北町,キタムログンキホクチョウ,キタムログンキホクチョウ
北相馬郡利根町,-1,-1,-7408,名詞,固有名詞,地域,一般,*,*,北相馬郡利根町,キタソウマグントネマチ,キタソウマグントネマチ
北秋田市,-1,-1,-3200,名詞,固有名詞,地域,一般,*,*,北秋田市,キタアキタシ,キタアキタシ
北秋田郡上小阿仁村,-1,-1,-10800,名詞,固有名詞,地域,一般,*,*,北秋田郡上小阿仁村,キタアキタグンカミコアニムラ,キタアキタグンカミコアニムラ
北群馬郡吉岡町,-1,-1,-7408,名詞,固有名詞,地域,一般,*,*,北群馬郡吉岡町,キタグンマグンヨシオカマチ,キタグンマグンヨシオカマチ
北群馬郡榛東村,-1,-1,-7408,名詞,固有名詞,地域,一般,*,*,北群馬郡榛東村,キタグンマグンシントウムラ,キタグンマグンシントウムラ
北茨城市,-1,-1,-3200,名詞,固有名詞,地域,一般,*,*,北茨城市,キタイバラキシ,キタイバラキシ
北葛城郡上牧町,-1,-1,-7408,名詞,固有名詞,地域,一般,*,*,北葛城郡上牧町,キタカツラギグンカンマキチョウ,キタカツラギグンカンマキチョウ
北葛城郡広陵町,-1,-1,-7408,名詞,固有名詞,地域,一般,*,*,北葛城郡広陵町,キタカツラギグンコウリョウチョウ,キタカツラギグンコウリョウチョウ
北葛城郡河合町,-1,-1,-7408,名詞,固有名詞,地域,一般,*,*,北葛城郡河合町,キタカツラギグンカワイチョウ,キタカツラギグンカワイチョウ
北葛城郡王寺町,-1,-1,-7408,名詞,固有名詞,地域,一般,*,*,北葛城郡王寺町,キタカツラギグンオウジチョウ,キタカツラギグンオウジチョウ
北葛飾郡杉戸町,-1,-1,-7408,名詞,固有名詞,地域,一般,*,*,北葛飾郡杉戸町,キタカツシカグンスギトマチ,キタカツシカグンスギトマチ
北葛飾郡松伏町,-1,-1,-7408,名詞,固有名詞,地域,一般,*,*,北葛飾郡松伏町,キタカツシカグンマツブシマチ,キタカツシカグンマツブシマチ
北蒲原郡聖籠町,-1,-1,-7408,名詞,固有名詞,地域,一般,*,*,北蒲原郡聖籠町,キタカンバラグンセイロウマチ,キタカンバラグンセイロウマチ
北見市,-1,-1,-2078,名詞,固有名詞,地域,一般,*,*,北見市,キタミシ,キタミシ
北設楽郡東栄町,-1,-1,-7408,名詞,固有名詞,地域,一般,*,*,北設楽郡東栄町,キタシタラグントウエイチョウ,キタシタラグントウエイチョウ
北設楽郡設楽町,-1,-1,-7408,名詞,固有名詞,地域,一般,*,*,北設楽郡設楽町,キタシタラグンシタラチョウ,キタシタラグンシタラチョウ
北設楽郡豊根村,-1,-1,-7408,名詞,固有名詞,地域,一般,*,*,北設楽郡豊根村,キタシタラグントヨネムラ,キタシタラグントヨネムラ
北諸県郡三股町,-1,-1,-7408,名詞,固有名詞,地域,一般,*,*,北諸県郡三股町,キタモロカタグンミマタチョウ,キタモロカタグンミマタチョウ
北足立郡伊奈町,-1,-1,-7408,名詞,固有名詞,地域,一般,*,*,北足立郡伊奈町,キタアダチグンイナマチ,キタアダチグンイナマチ
北都留郡丹波山村,-1,-1,-9050,名詞,固有名詞,地域,一般,*,*,北都留郡丹波山村,キタツルグンタバヤマムラ,キタツルグンタバヤマムラ
北都留郡小菅村,-1,-1,-7408,名詞,固有名詞,地域,一般,*,*,北都留郡小菅村,キタツルグンコスゲムラ,キタツルグンコスゲムラ
匝瑳市,-1,-1,-2078,名詞,固有名詞,地域,一般,*,*,匝瑳市,ソウサシ,ソウサシ
十勝郡浦幌町,-1,-1,-5878,名詞,固有名詞,地域,一般,*,*,十勝郡浦幌町,トカチグンウラホロチョウ,トカチグンウラホロチョウ
十和田市,-1,-1,-3200,名詞,固有名詞,地域,一般,*,*,十和田市,トワダシ,トワダシ
十日町市,-1,-1,-3200,名詞,固有名詞,地域,一般,*,*,十日町市,トオカマチシ,トオカマチシ
千代田区,-1,-1,-3200,名詞,固有名詞,地域,一般,*,*,千代田区,チヨダク,チヨダク
千曲市,-1,-1,-2078,名詞,固有名詞,地域,一般,*,*,千曲市,チクマシ,チクマシ
千歳市,-1,-1,-2078,名詞,固有名詞,地域,一般,*,*,千歳市,チトセシ,チトセシ
千葉市中央区,-1,-1,-5878,名詞,固有名詞,地域,一般,*,*,千葉市中央区,チバシチュウオウク,チバシチュウオウク
千葉市稲毛区,-1,-1,-5878,名詞,固有名詞,地域,一般,*,*,千葉市稲毛区,チバシイナゲク,チバシイナゲク
千葉市緑区,-1,-1,-4472,名詞,固有名詞,地域,一般,*,*,千葉市緑区,チバシミドリク,チバシミドリク
千葉市美浜区,-1,-1,-5878,名詞,固有名詞,地域,一般,*,*,千葉市美浜区,チバシミハマク,チバシミハマク
千葉市花見川区,-1,-1,-7408,名詞,固有名詞,地域,一般,*,*,千葉市花見川区,チバシハナミガワク,チバシハナミガワク
千葉市若葉区,-1,-1,-5878,名詞,固有名詞,地域,一般,*,*,千葉市若葉区,チバシワカバク,チバシワカバク
千葉県,-1,-1,-2078,名詞,固有名詞,地域,一般,*,*,千葉県,チバケン,チバケン
半田市,-1,-1,-2078,名詞,固有名詞,地域,一般,*,*,半田市,ハンダシ,ハンダシ
南アルプス市,-1,-1,-5878,名詞,固有名詞,地域,一般,*,*,南アルプス市,ミナミアルプスシ,ミナミアルプスシ
南あわじ市,-1,-1,-4472,名詞,固有名詞,地域,一般,*,*,南あわじ市,ミナミアワジシ,ミナミアワジシ
南さつま市,-1,-1,-4472,名詞,固有名詞,地域,一般,*,*,南さつま市,ミナミサツマシ,ミナミサツマシ
南丹市,-1,-1,-2078,名詞,固有名詞,地域,一般,*,*,南丹市,ナンタンシ,ナンタンシ
南九州市,-1,-1,-3200,名詞,固有名詞,地域,一般,*,*,南九州市,ミナミキュウシュウシ,ミナミキュウシュウシ
南会津郡下郷町,-1,-1,-7408,名詞,固有名詞,地域,一般,*,*,南会津郡下郷町,ミナミアイヅグンシモゴウマチ,ミナミアイヅグンシモゴウマチ
南会津郡南会津町,-1,-1,-9050,名詞,固有名詞,地域,一般,*,*,南会津郡南会津町,ミナミアイヅグンミナミアイヅマチ,ミナミアイヅグンミナミアイヅマチ
南会津郡只見町,-1,-1,-7408,名詞,固有名詞,地域,一般,*,*,南会津郡只見町,ミナミアイヅグンタダミマチ,ミナミアイヅグンタダミマチ
南会津郡檜枝岐村,-1,-1,-9050,名詞,固有名詞,地域,一般,*,*,南会津郡檜枝岐村,ミナミアイヅグンヒノエマタムラ,ミナミアイヅグンヒノエマタムラ
南佐久郡佐久穂町,-1,-1,-9050,名詞,固有名詞,地域,一般,*,*,南佐久郡佐久穂町,ミナミサクグンサクホマチ,ミナミサクグンサクホマチ
南佐久郡北相木村,-1,-1,-9050,名詞,固有名詞,地域,一般,*,*,南佐久郡北相木村,ミナミサクグンキタアイキムラ,ミナミサクグンキタアイキムラ
南佐久郡南牧村,-1,-1,-7408,名詞,固有名詞,地域,一般,*,*,南佐久郡南牧村,ミナミサクグンミナミマキムラ,ミナミサクグンミナミマキムラ
南佐久郡南相木村,-1,-1,-9050,名詞,固有名詞,地域,一般,*,*,南佐久郡南相木村,ミナミサクグンミナミアイキムラ,ミナミサクグンミナミアイキムラ
南佐久郡小海町,-1,-1,-7408,名詞,固有名詞,地域,一般,*,*,南佐久郡小海町,ミナミサクグンコウミマチ,ミナミサクグンコウミマチ
南佐久郡川上村,-1,-1,-7408,名詞,固有名詞,地域,一般,*,*,南佐久郡川上村,ミナミサクグンカワカミムラ,ミナミサクグンカワカミムラ
南国市,-1,-1,-2078,名詞,固有名詞,地域,一般,*,*,南国市,ナンコクシ,ナンコクシ
南城市,-1,-1,-2078,名詞,固有名詞,地域,一般,*,*,南城市,ナンジョウシ,ナンジョウシ
南埼玉郡宮代町,-1,-1,-7408,名詞,固有名詞,地域,一般,*,*,南埼玉郡宮代町,ミナミサイタマグンミヤシロマチ,ミナミサイタマグンミヤシロマチ
南宇和郡愛南町,-1,-1,-7408,名詞,固有名詞,地域,一般,*,*,南宇和郡愛南町,ミナミウワグンアイナンチョウ,ミナミウワグンアイナンチョウ
南島原市,-1,-1,-3200,名詞,固有名詞,地域,一般,*,*,南島原市,ミナミシマバラシ,ミナミシマバラシ
南巨摩郡南部町,-1,-1,-7408,名詞,固有名詞,地域,一般,*,*,南巨摩郡南部町,ミナミコマグンナンブチョウ,ミナミコマグンナンブチョウ
南巨摩郡富士川町,-1,-1,-9050,名詞,固有名詞,地域,一般,*,*,南巨摩郡富士川町,ミナミコマグンフジカワチョウ,ミナミコマグンフジカワチョウ
南巨摩郡早川町,-1,-1,-7408,名詞,固有名詞,地域,一般,*,*,南巨摩郡早川町,ミナミコマグンハヤカワチョウ,ミナミコマグンハヤカワチョウ
南巨摩郡身延町,-1,-1,-7408,名詞,固有名詞,地域,一般,*,*,南巨摩郡身延町,ミナミコマグンミノブチョウ,ミナミコマグンミノブチョウ
南房総市,-1,-1,-3200,名詞,固有名詞,地域,一般,*,*,南房総市,ミナミボウソウシ,ミナミボウソウシ
南条郡南越前町,-1,-1,-7408,名詞,固有名詞,地域,一般,*,*,南条郡南越前町,ナンジョウグンミナミエチゼンチョウ,ナンジョウグンミナミエチゼンチョウ
南松浦郡新上五島町,-1,-1,-10800,名詞,固有名詞,地域,一般,*,*,南松浦郡新上五島町,ミナミマツウラグンシンカミゴトウチョウ,ミナミマツウラグンシンカミゴトウチョウ
南河内郡千早赤阪村,-1,-1,-10800,名詞,固有名詞,地域,一般,*,*,南河内郡千早赤阪村,ミナミカワチグンチハヤアカサカムラ,ミナミカワチグンチハヤアカサカムラ
南河内郡太子町,-1,-1,-7408,名詞,固有名詞,地域,一般,*,*,南河内郡太子町,ミナミカワチグンタイシチョウ,ミナミカワチグンタイシチョウ
南河内郡河南町,-1,-1,-7408,名詞,固有名詞,地域,一般,*,*,南河内郡河南町,ミナミカワチグンカナンチョウ,ミナミカワチグンカナンチョウ
南津軽郡大鰐町,-1,-1,-7408,名詞,固有名詞,地域,一般,*,*,南津軽郡大鰐町,ミナミツガルグンオオワニマチ,ミナミツガルグンオオワニマチ
南津軽郡田舎館村,-1,-1,-9050,名詞,固有名詞,地域,一般,*,*,南津軽郡田舎館村,ミナミツガルグンイナカダテムラ,ミナミツガルグンイナカダテムラ
南津軽郡藤崎町,-1,-1,-7408,名詞,固有名詞,地域,一般,*,*,南津軽郡藤崎町,ミナミツガルグンフジサキマチ,ミナミツガルグンフジサキマチ
南牟婁郡御浜町,-1,-1,-7408,名詞,固有名詞,地域,一般,*,*,南牟婁郡御浜町,ミナミムログンミハマチョウ,ミナミムログンミハマチョウ
南牟婁郡紀宝町,-1,-1,-7408,名詞,固有名詞,地域,一般,*,*,南牟婁郡紀宝町,ミナミムログンキホウチョウ,ミナミムログンキホウチョウ
南相馬市,-1,-1,-3200,名詞,固有名詞,地域,一般,*,*,南相馬市,ミナミソウマシ,ミナミソウマシ
南砺市,-1,-1,-2078,名詞,固有名詞,地域,一般,*,*,南砺市,ナントシ,ナントシ
南秋田郡五城目町,-1,-1,-9050,名詞,固有名詞,地域,一般,*,*,南秋田郡五城目町,ミナミアキタグンゴジョウメマチ,ミナミアキタグンゴジョウメマチ
南秋田郡井川町,-1,-1,-7408,名詞,固有名詞,地域,一般,*,*,南秋田郡井川町,ミナミアキタグンイカワマチ,ミナミアキタグンイカワマチ
南秋田郡八郎潟町,-1,-1,-9050,名詞,固有名詞,地域,一般,*,*,南秋田郡八郎潟町,ミナミアキタグンハチロウガタマチ,ミナミアキタグンハチロウガタマチ
南秋田郡大潟村,-1,-1,-7408,名詞,固有名詞,地域,一般,*,*,南秋田郡大潟村,ミナミアキタグンオオガタムラ,ミナミアキタグンオオガタムラ
南蒲原郡田上町,-1,-1,-7408,名詞,固有名詞,地域,一般,*,*,南蒲原郡田上町,ミナミカンバラグンタガミマチ,ミナミカンバラグンタガミマチ
南足柄市,-1,-1,-3200,名詞,固有名詞,地域,一般,*,*,南足柄市,ミナミアシガラシ,ミナミアシガラシ
南都留郡富士河口湖町,-1,-1,-12649,名詞,固有名詞,地域,一般,*,*,南都留郡富士河口湖町,ミナミツルグンフジカワグチコマチ,ミナミツルグンフジカワグチコマチ
南都留郡山中湖村,-1,-1,-9050,名詞,固有名詞,地域,一般,*,*,南都留郡山中湖村,ミナミツルグンヤマナカコムラ,ミナミツルグンヤマナカコムラ
南都留郡忍野村,-1,-1,-7408,名詞,固有名詞,地域,一般,*,*,南都留郡忍野村,ミナミツルグンオシノムラ,ミナミツルグンオシノムラ
南都留郡西桂町,-1,-1,-7408,名詞,固有名詞,地域,一般,*,*,南都留郡西桂町,ミナミツルグンニシカツラチョウ,ミナミツルグンニシカツラチョウ
南都留郡道志村,-1,-1,-7408,名詞,固有名詞,地域,一般,*,*,南都留郡道志村,ミナミツルグンドウシムラ,ミナミツルグンドウシムラ
南都留郡鳴沢村,-1,-1,-7408,名詞,固有名詞,地域,一般,*,*,南都留郡鳴沢村,ミナミツルグンナルサワムラ,ミナミツルグンナルサワムラ
南陽市,-1,-1,-2078,名詞,固有名詞,地域,一般,*,*,南陽市,ナンヨウシ,ナンヨウシ
南魚沼市,-1,-1,-3200,名詞,固有名詞,地域,一般,*,*,南魚沼市,ミナミウオヌマシ,ミナミウオヌマシ
南魚沼郡湯沢町,-1,-1,-7408,名詞,固有名詞,地域,一般,*,*,南魚沼郡湯沢町,ミナミウオヌマグンユザワマチ,ミナミウオヌマグンユザワマチ
印旛郡栄町,-1,-1,-4472,名詞,固有名詞,地域,一般,*,*,印旛郡栄町,インバグンサカエマチ,インバグンサカエマチ
印旛郡酒々井町,-1,-1,-7408,名詞,固有名詞,地域,一般,*,*,印旛郡酒々井町,インバグンシスイマチ,インバグンシスイマチ
印西市,-1,-1,-2078,名詞,固有名詞,地域,一般,*,*,印西市,インザイシ,インザイシ
厚岸郡厚岸町,-1,-1,-5878,名詞,固有名詞,地域,一般,*,*,厚岸郡厚岸町,アッケシグンアッケシチョウ,アッケシグンアッケシチョウ
厚岸郡浜中町,-1,-1,-5878,名詞,固有名詞,地域,一般,*,*,厚岸郡浜中町,アッケシグンハマナカチョウ,アッケシグンハマナカチョウ
厚木市,-1,-1,-2078,名詞,固有名詞,地域,一般,*,*,厚木市,アツギシ,アツギシ
双葉郡双葉町,-1,-1,-5878,名詞,固有名詞,地域,一般,*,*,双葉郡双葉町,フタバグンフタバマチ,フタバグンフタバマチ
双葉郡大熊町,-1,-1,-5878,名詞,固有名詞,地域,一般,*,*,双葉郡大熊町,フタバグンオオクママチ,フタバグンオオクママチ
双葉郡富岡町,-1,-1,-5878,名詞,固有名詞,地域,一般,*,*,双葉郡富岡町,フタバグントミオカマチ,フタバグントミオカマチ
双葉郡川内村,-1,-1,-5878,名詞,固有名詞,地域,一般,*,*,双葉郡川内村,フタバグンカワウチムラ,フタバグンカワウチムラ
双葉郡広野町,-1,-1,-5878,名詞,固有名詞,地域,一般,*,*,双葉郡広野町,フタバグンヒロノマチ,フタバグンヒロノマチ
双葉郡楢葉町,-1,-1,-5878,名詞,固有名詞,地域,一般,*,*,双葉郡楢葉町,フタバグンナラハマチ,フタバグンナラハマチ
双葉郡浪江町,-1,-1,-5878,名詞,固有名詞,地域,一般,*,*,双葉郡浪江町,フタバグンナミエマチ,フタバグンナミエマチ
双葉郡葛尾村,-1,-1,-5878,名詞,固有名詞,地域,一般,*,*,双葉郡葛尾村,フタバグンカツラオムラ,フタバグンカツラオムラ
取手市,-1,-1,-2078,名詞,固有名詞,地域,一般,*,*,取手市,トリデシ,トリデシ
古宇郡泊村,-1,-1,-4472,名詞,固有名詞,地域,一般,*,*,古宇郡泊村,フルウグントマリムラ,フルウグントマリムラ
古宇郡神恵内村,-1,-1,-7408,名詞,固有名詞,地域,一般,*,*,古宇郡神恵内村,フルウグンカモエナイムラ,フルウグンカモエナイムラ
古平郡古平町,-1,-1,-5878,名詞,固有名詞,地域,一般,*,*,古平郡古平町,フルビラグンフルビラチョウ,フルビラグンフルビラチョウ
古河市,-1,-1,-2078,名詞,固有名詞,地域,一般,*,*,古河市,コガシ,コガシ
古賀市,-1,-1,-2078,名詞,固有名詞,地域,一般,*,*,古賀市,コガシ,コガシ
可児市,-1,-1,-2078,名詞,固有名詞,地域,一般,*,*,可児市,カニシ,カニシ
可児郡御嵩町,-1,-1,-5878,名詞,固有名詞,地域,一般,*,*,可児郡御嵩町,カニグンミタケチョウ,カニグンミタケチョウ
台東区,-1,-1,-2078,名詞,固有名詞,地域,一般,*,*,台東区,タイトウク,タイトウク
各務原市,-1,-1,-3200,名詞,固有名詞,地域,一般,*,*,各務原市,カカミガハラシ,カカミガハラシ
合志市,-1,-1,-2078,名詞,固有名詞,地域,一般,*,*,合志市,コウシシ,コウシシ
吉川市,-1,-1,-2078,名詞,固有名詞,地域,一般,*,*,吉川市,ヨシカワシ,ヨシカワシ
吉田郡永平寺町,-1,-1,-7408,名詞,固有名詞,地域,一般,*,*,吉田郡永平寺町,ヨシダグンエイヘイジチョウ,ヨシダグンエイヘイジチョウ
吉野川市,-1,-1,-3200,名詞,固有名詞,地域,一般,*,*,吉野川市,ヨシノガワシ,ヨシノガワシ
吉野郡上北山村,-1,-1,-7408,名詞,固有名詞,地域,一般,*,*,吉野郡上北山村,ヨシノグンカミキタヤマムラ,ヨシノグンカミキタヤマムラ
吉野郡下北山村,-1,-1,-7408,名詞,固有名詞,地域,一般,*,*,吉野郡下北山村,ヨシノグンシモキタヤマムラ,ヨシノグンシモキタヤマムラ
吉野郡下市町,-1,-1,-5878,名詞,固有名詞,地域,一般,*,*,吉野郡下市町,ヨシノグンシモイチチョウ,ヨシノグンシモイチチョウ
吉野郡十津川村,-1,-1,-7408,名詞,固有名詞,地域,一般,*,*,吉野郡十津川村,ヨシノグントツカワムラ,ヨシノグントツカワムラ
吉野郡吉野町,-1,-1,-5878,名詞,固有名詞,地域,一般,*,*,吉野郡吉野町,ヨシノグンヨシノチョウ,ヨシノグンヨシノチョウ
吉野郡大淀町,-1,-1,-5878,名詞,固有名詞,地域,一般,*,*,吉野郡大淀町,ヨシノグンオオヨドチョウ,ヨシノグンオオヨドチョウ
吉野郡天川村,-1,-1,-5878,名詞,固有名詞,地域,一般,*,*,吉野郡天川村,ヨシノグンテンカワムラ,ヨシノグンテンカワムラ
吉野郡川上村,-1,-1,-5878,名詞,固有名詞,地域,一般,*,*,吉野郡川上村,ヨシノグンカワカミムラ,ヨシノグンカワカミムラ
吉野郡東吉野村,-1,-1,-7408,名詞,固有名詞,地域,一般,*,*,吉野郡東吉野村,ヨシノグンヒガシヨシノムラ,ヨシノグンヒガシヨシノムラ
吉野郡野迫川村,-1,-1,-7408,名詞,固有名詞,地域,一般,*,*,吉野郡野迫川村,ヨシノグンノセガワムラ,ヨシノグンノセガワムラ
吉野郡黒滝村,-1,-1,-5878,名詞,固有名詞,地域,一般,*,*,吉野郡黒滝村,ヨシノグンクロタキムラ,ヨシノグンクロタキムラ
名取市,-1,-1,-2078,名詞,固有名詞,地域,一般,*,*,名取市,ナトリシ,ナトリシ
名古屋市中区,-1,-1,-5878,名詞,固有名詞,地域,一般,*,*,名古屋市中区,ナゴヤシナカク,ナゴヤシナカク
名古屋市中川区,-1,-1,-7408,名詞,固有名詞,地域,一般,*,*,名古屋市中川区,ナゴヤシナカガワク,ナゴヤシナカガワク
名古屋市中村区,-1,-1,-7408,名詞,固有名詞,地域,一般,*,*,名古屋市中村区,ナゴヤシナカムラク,ナゴヤシナカムラク
名古屋市北区,-1,-1,-5878,名詞,固有名詞,地域,一般,*,*,名古屋市北区,ナゴヤシキタク,ナゴヤシキタク
名古屋市千種区,-1,-1,-7408,名詞,固有名詞,地域,一般,*,*,名古屋市千種区,ナゴヤシチクサク,ナゴヤシチクサク
名古屋市南区,-1,-1,-5878,名詞,固有名詞,地域,一般,*,*,名古屋市南区,ナゴヤシミナミク,ナゴヤシミナミク
名古屋市名東区,-1,-1,-7408,名詞,固有名詞,地域,一般,*,*,名古屋市名東区,ナゴヤシメイトウク,ナゴヤシメイトウク
名古屋市天白区,-1,-1,-7408,名詞,固有名詞,地域,一般,*,*,名古屋市天白区,ナゴヤシテンパクク,ナゴヤシテンパクク
名古屋市守山区,-1,-1,-7408,名詞,固有名詞,地域,一般,*,*,名古屋市守山区,ナゴヤシモリヤマク,ナゴヤシモリヤマク
名古屋市昭和区,-1,-1,-7408,名詞,固有名詞,地域,一般,*,*,名古屋市昭和区,ナゴヤシショウワク,ナゴヤシショウワク
